{
  "schema_version": "keyword-profile/v1",
  "asset_id": "tech-keyword-sample",
  "word": " 洋务运动 ",
  "pinyin": "",
  "gloss": "仅用于验证关键词档案归档契约。",
  "era": "近代",
  "category": "改革",
  "examples": [
    "师夷长技以自强。"
  ],
  "related_people": [
    "历史人物"
  ],
  "related_lessons": [
    "lesson-sample"
  ],
  "source_refs": [
    {
      "title": "资料标题",
      "source": "教材或史料",
      "url_or_path": "",
      "citation_note": "页码或版本说明",
      "reliability": "pending"
    }
  ],
  "teacher_notes": "",
  "status": "sealed",
  "version": 1,
  "created_at": "2026-07-25T18:06:58.979485Z",
  "updated_at": "2026-07-25T18:06:58.994921Z",
  "sealed_at": "2026-07-25T18:06:58.994921Z",
  "sealed_by": "contract-test",
  "checksum": "d54dac09733ce4f0bfcdaf521e8ddc4ad587d99c7d4c8538c26ec5be37398663"
}
